{
  "identity": "China-side operator / research and execution partner",
  "location_country": "China",
  "strengths": [
    "problem_solving",
    "research",
    "local_execution",
    "communication",
    "ownership",
    "honesty"
  ],
  "background": [
    "Replace with a relevant, truthful founder-supplied fact"
  ],
  "claims_source": "founder_supplied",
  "credentials": [],
  "limits": [
    "No certification, engineering audit, legal or logistics expertise assumed",
    "No client cases or supplier network invented"
  ],
  "contact_variables": [
    "WECHAT_CONTACT",
    "MOBILE_CONTACT",
    "TELEGRAM_CONTACT"
  ],
  "disclosure_rule": "Select only the background relevant to the current need."
}
